{
  "$schema": "https://json-schema.org/draft/2020-12/schema",
  "type": "object",
  "properties": {
    "$schema": {
      "type": "string"
    },
    "schemaVersion": {
      "type": "number",
      "const": 1
    },
    "id": {
      "type": "string",
      "pattern": "^[a-z0-9-]+\\/[a-z0-9-]+$"
    },
    "university": {
      "type": "object",
      "properties": {
        "slug": {
          "type": "string",
          "pattern": "^[a-z0-9]+(?:-[a-z0-9]+)*$"
        },
        "name": {
          "type": "string",
          "minLength": 1
        }
      },
      "required": [
        "slug",
        "name"
      ]
    },
    "programme": {
      "type": "object",
      "properties": {
        "slug": {
          "type": "string",
          "pattern": "^[a-z0-9]+(?:-[a-z0-9]+)*$"
        },
        "name": {
          "type": "string",
          "minLength": 1
        },
        "degree": {
          "type": "string",
          "enum": [
            "bsc",
            "msc"
          ]
        }
      },
      "required": [
        "slug",
        "name",
        "degree"
      ]
    },
    "poVersion": {
      "type": "string",
      "minLength": 1
    },
    "handbookVersion": {
      "type": "string",
      "minLength": 1
    },
    "standardSemesters": {
      "type": "integer",
      "minimum": 1,
      "maximum": 14
    },
    "totalCredits": {
      "type": "number",
      "minimum": 0
    },
    "creditLabel": {
      "type": "string",
      "enum": [
        "ECTS",
        "LP",
        "CP"
      ]
    },
    "codesAreOfficial": {
      "type": "boolean"
    },
    "examRules": {
      "type": "object",
      "properties": {
        "withdrawalDaysBeforeExam": {
          "type": "integer",
          "minimum": 0,
          "maximum": 60
        },
        "maxAttempts": {
          "type": "integer",
          "minimum": 1,
          "maximum": 10
        },
        "retakePassedExams": {
          "type": "boolean"
        },
        "supplementaryExamOnLastAttempt": {
          "type": "boolean"
        }
      }
    },
    "transitions": {
      "type": "array",
      "items": {
        "type": "object",
        "properties": {
          "fromPresetId": {
            "type": "string",
            "pattern": "^[a-z0-9-]+\\/[a-z0-9-]+$"
          },
          "moduleMap": {
            "type": "array",
            "items": {
              "type": "object",
              "properties": {
                "from": {
                  "type": "string",
                  "minLength": 1
                },
                "to": {
                  "type": "string",
                  "minLength": 1
                }
              },
              "required": [
                "from",
                "to"
              ]
            }
          },
          "notes": {
            "type": "string"
          }
        },
        "required": [
          "fromPresetId",
          "moduleMap"
        ]
      }
    },
    "notes": {
      "type": "string"
    },
    "gradeRules": {
      "type": "object",
      "properties": {
        "allowedValues": {
          "minItems": 2,
          "type": "array",
          "items": {
            "type": "number",
            "minimum": 1,
            "maximum": 5
          }
        },
        "standardGrades": {
          "type": "array",
          "items": {
            "type": "number",
            "minimum": 1,
            "maximum": 5
          }
        },
        "passThreshold": {
          "type": "number",
          "minimum": 1,
          "maximum": 5
        },
        "attemptSelection": {
          "type": "string",
          "enum": [
            "best",
            "latest"
          ]
        },
        "finalRounding": {
          "type": "object",
          "properties": {
            "mode": {
              "type": "string",
              "enum": [
                "truncate",
                "round_half_up",
                "round_to_nearest_allowed_ties_better"
              ]
            },
            "precision": {
              "anyOf": [
                {
                  "type": "number",
                  "const": 1
                },
                {
                  "type": "number",
                  "const": 2
                }
              ]
            }
          },
          "required": [
            "mode",
            "precision"
          ]
        },
        "aggregation": {
          "$ref": "#/$defs/__schema0"
        }
      },
      "required": [
        "allowedValues",
        "passThreshold",
        "attemptSelection",
        "finalRounding",
        "aggregation"
      ]
    },
    "modules": {
      "minItems": 1,
      "type": "array",
      "items": {
        "type": "object",
        "properties": {
          "code": {
            "type": "string",
            "minLength": 1
          },
          "name": {
            "type": "string",
            "minLength": 1
          },
          "credits": {
            "type": "number",
            "minimum": 0
          },
          "grading": {
            "type": "string",
            "enum": [
              "graded",
              "pass_fail"
            ]
          },
          "countsTowardAverage": {
            "type": "boolean"
          },
          "category": {
            "type": "string",
            "minLength": 1
          },
          "offering": {
            "type": "string",
            "enum": [
              "winter",
              "summer",
              "both",
              "irregular"
            ]
          },
          "typicalSemester": {
            "type": "integer",
            "minimum": 1,
            "maximum": 14
          },
          "prerequisites": {
            "type": "array",
            "items": {
              "anyOf": [
                {
                  "type": "string",
                  "minLength": 1
                },
                {
                  "type": "object",
                  "properties": {
                    "anyOf": {
                      "minItems": 2,
                      "type": "array",
                      "items": {
                        "type": "string",
                        "minLength": 1
                      }
                    }
                  },
                  "required": [
                    "anyOf"
                  ]
                }
              ]
            }
          },
          "requiresCredits": {
            "type": "number",
            "minimum": 0
          },
          "maxAttempts": {
            "type": "integer",
            "minimum": 1,
            "maximum": 10
          },
          "details": {
            "type": "object",
            "properties": {
              "englishName": {
                "type": "string",
                "minLength": 1
              },
              "responsible": {
                "type": "array",
                "items": {
                  "type": "string",
                  "minLength": 1
                }
              },
              "lecturers": {
                "type": "array",
                "items": {
                  "type": "string",
                  "minLength": 1
                }
              },
              "examiners": {
                "type": "array",
                "items": {
                  "type": "string",
                  "minLength": 1
                }
              },
              "organisationalUnit": {
                "type": "string",
                "minLength": 1
              },
              "languages": {
                "type": "array",
                "items": {
                  "type": "string",
                  "minLength": 1
                }
              },
              "frequency": {
                "type": "string",
                "minLength": 1
              },
              "durationSemesters": {
                "type": "integer",
                "minimum": 1,
                "maximum": 6
              },
              "sws": {
                "type": "number",
                "minimum": 0,
                "maximum": 60
              },
              "courses": {
                "type": "array",
                "items": {
                  "type": "object",
                  "properties": {
                    "type": {
                      "type": "string",
                      "minLength": 1
                    },
                    "title": {
                      "type": "string",
                      "minLength": 1
                    },
                    "sws": {
                      "type": "number",
                      "minimum": 0,
                      "maximum": 60
                    }
                  },
                  "required": [
                    "type"
                  ]
                }
              },
              "workload": {
                "type": "object",
                "properties": {
                  "totalHours": {
                    "type": "number",
                    "minimum": 0,
                    "maximum": 10000
                  },
                  "contactHours": {
                    "type": "number",
                    "minimum": 0,
                    "maximum": 10000
                  },
                  "selfStudyHours": {
                    "type": "number",
                    "minimum": 0,
                    "maximum": 10000
                  }
                }
              },
              "examForms": {
                "type": "array",
                "items": {
                  "type": "string",
                  "minLength": 1
                }
              },
              "examRegistration": {
                "type": "string",
                "minLength": 1
              },
              "courseworkRequirements": {
                "type": "array",
                "items": {
                  "type": "string",
                  "minLength": 1
                }
              },
              "gradingNote": {
                "type": "string",
                "minLength": 1
              },
              "participationRequirements": {
                "type": "string",
                "minLength": 1
              },
              "recommendedPrerequisites": {
                "type": "string",
                "minLength": 1
              },
              "learningOutcomes": {
                "type": "string",
                "minLength": 1
              },
              "content": {
                "type": "string",
                "minLength": 1
              },
              "literature": {
                "type": "array",
                "items": {
                  "type": "string",
                  "minLength": 1
                }
              },
              "teachingMethods": {
                "type": "string",
                "minLength": 1
              },
              "usability": {
                "type": "string",
                "minLength": 1
              },
              "specialisations": {
                "type": "array",
                "items": {
                  "type": "string",
                  "minLength": 1
                }
              },
              "website": {
                "type": "string",
                "minLength": 1
              },
              "remarks": {
                "type": "string",
                "minLength": 1
              },
              "additionalFields": {
                "type": "array",
                "items": {
                  "type": "object",
                  "properties": {
                    "label": {
                      "type": "string",
                      "minLength": 1
                    },
                    "value": {
                      "type": "string",
                      "minLength": 1
                    }
                  },
                  "required": [
                    "label",
                    "value"
                  ]
                }
              }
            }
          }
        },
        "required": [
          "code",
          "name",
          "credits",
          "grading",
          "countsTowardAverage",
          "category",
          "offering"
        ]
      }
    },
    "areas": {
      "type": "array",
      "items": {
        "type": "object",
        "properties": {
          "id": {
            "type": "string",
            "pattern": "^[a-z0-9]+(?:-[a-z0-9]+)*$"
          },
          "name": {
            "type": "string",
            "minLength": 1
          },
          "minCredits": {
            "type": "number",
            "minimum": 0
          },
          "maxCredits": {
            "type": "number",
            "minimum": 0
          },
          "moduleCodes": {
            "minItems": 1,
            "type": "array",
            "items": {
              "type": "string"
            }
          }
        },
        "required": [
          "id",
          "name",
          "minCredits",
          "moduleCodes"
        ]
      }
    }
  },
  "required": [
    "schemaVersion",
    "id",
    "university",
    "programme",
    "poVersion",
    "handbookVersion",
    "standardSemesters",
    "totalCredits",
    "creditLabel",
    "codesAreOfficial",
    "gradeRules",
    "modules",
    "areas"
  ],
  "$defs": {
    "__schema0": {
      "type": "object",
      "properties": {
        "id": {
          "type": "string",
          "minLength": 1
        },
        "label": {
          "type": "string"
        },
        "weightMode": {
          "type": "string",
          "enum": [
            "credits",
            "fixed"
          ]
        },
        "roundResult": {
          "type": "object",
          "properties": {
            "mode": {
              "type": "string",
              "enum": [
                "truncate",
                "round_half_up",
                "round_to_nearest_allowed_ties_better"
              ]
            },
            "precision": {
              "anyOf": [
                {
                  "type": "number",
                  "const": 1
                },
                {
                  "type": "number",
                  "const": 2
                }
              ]
            }
          },
          "required": [
            "mode",
            "precision"
          ]
        },
        "dropWorst": {
          "type": "object",
          "properties": {
            "maxCredits": {
              "type": "number",
              "minimum": 0
            }
          },
          "required": [
            "maxCredits"
          ]
        },
        "keepBest": {
          "type": "object",
          "properties": {
            "maxCredits": {
              "type": "number",
              "minimum": 0
            },
            "quotas": {
              "type": "array",
              "items": {
                "type": "object",
                "properties": {
                  "label": {
                    "type": "string"
                  },
                  "codes": {
                    "minItems": 1,
                    "type": "array",
                    "items": {
                      "type": "string",
                      "minLength": 1
                    }
                  },
                  "minCredits": {
                    "type": "number",
                    "minimum": 0
                  },
                  "maxCredits": {
                    "type": "number",
                    "minimum": 0
                  }
                },
                "required": [
                  "codes",
                  "minCredits"
                ]
              }
            }
          },
          "required": [
            "maxCredits"
          ]
        },
        "children": {
          "minItems": 1,
          "type": "array",
          "items": {
            "oneOf": [
              {
                "type": "object",
                "properties": {
                  "kind": {
                    "type": "string",
                    "const": "module"
                  },
                  "code": {
                    "type": "string",
                    "minLength": 1
                  },
                  "factor": {
                    "anyOf": [
                      {
                        "type": "number",
                        "const": 0
                      },
                      {
                        "type": "number",
                        "const": 0.5
                      },
                      {
                        "type": "number",
                        "const": 1
                      },
                      {
                        "type": "number",
                        "const": 2
                      }
                    ]
                  },
                  "weight": {
                    "type": "number",
                    "exclusiveMinimum": 0
                  }
                },
                "required": [
                  "kind",
                  "code"
                ]
              },
              {
                "type": "object",
                "properties": {
                  "kind": {
                    "type": "string",
                    "const": "group"
                  },
                  "weight": {
                    "type": "number",
                    "exclusiveMinimum": 0
                  },
                  "node": {
                    "$ref": "#/$defs/__schema0"
                  }
                },
                "required": [
                  "kind",
                  "node"
                ]
              }
            ]
          }
        }
      },
      "required": [
        "id",
        "weightMode",
        "children"
      ]
    }
  }
}
