{
  "$schema": "../preset.schema.json",
  "schemaVersion": 1,
  "id": "example/informatik-bsc-example-2027",
  "university": {
    "slug": "example",
    "name": "Beispiel-Universität"
  },
  "programme": {
    "slug": "informatik-bsc-example",
    "name": "Informatik",
    "degree": "bsc"
  },
  "poVersion": "PO 2027 (fiktiv)",
  "handbookVersion": "Modulhandbuch WS 2027/28 (fiktiv)",
  "standardSemesters": 6,
  "totalCredits": 180,
  "creditLabel": "ECTS",
  "codesAreOfficial": true,
  "examRules": {
    "withdrawalDaysBeforeExam": 7,
    "maxAttempts": 3,
    "retakePassedExams": false
  },
  "transitions": [
    {
      "fromPresetId": "example/informatik-bsc-example",
      "moduleMap": [
        {
          "from": "MAT-101",
          "to": "MAT-111"
        },
        {
          "from": "INF-201",
          "to": "INF-211"
        }
      ],
      "notes": "Fiktive Übergangsregelung: Lineare Algebra I und Rechnerarchitektur werden mit Note übernommen. IT-Sicherheit entfällt; ein bereits abgelegtes Ergebnis bleibt im Plan, zählt aber nicht mehr."
    }
  ],
  "notes": "Fictional successor of example/informatik-bsc-example for tests and demos of a PO switch. Lineare Algebra I continues as Lineare Algebra (new code, same credits), Rechnerarchitektur becomes Rechnerarchitektur und Betriebssysteme (new code, 8 ECTS), IT-Sicherheit is dropped and Maschinelles Lernen is new. Attempt limits: 3 attempts, no retakes of passed exams.",
  "gradeRules": {
    "allowedValues": [1.0, 1.3, 1.7, 2.0, 2.3, 2.7, 3.0, 3.3, 3.7, 4.0, 5.0],
    "passThreshold": 4.0,
    "attemptSelection": "best",
    "finalRounding": {
      "mode": "truncate",
      "precision": 1
    },
    "aggregation": {
      "id": "gesamtnote",
      "label": "Gesamtnote",
      "weightMode": "credits",
      "children": [
        {
          "kind": "group",
          "node": {
            "id": "grundlagen",
            "label": "Grundlagen",
            "weightMode": "credits",
            "roundResult": {
              "mode": "truncate",
              "precision": 1
            },
            "children": [
              {
                "kind": "module",
                "code": "INF-101"
              },
              {
                "kind": "module",
                "code": "INF-102"
              },
              {
                "kind": "module",
                "code": "MAT-111"
              },
              {
                "kind": "module",
                "code": "MAT-102"
              }
            ]
          }
        },
        {
          "kind": "group",
          "node": {
            "id": "vertiefung",
            "label": "Vertiefung",
            "weightMode": "credits",
            "dropWorst": {
              "maxCredits": 6
            },
            "children": [
              {
                "kind": "module",
                "code": "INF-211"
              },
              {
                "kind": "module",
                "code": "INF-202"
              },
              {
                "kind": "module",
                "code": "WP-401"
              },
              {
                "kind": "module",
                "code": "WP-403"
              }
            ]
          }
        },
        {
          "kind": "module",
          "code": "BA-601",
          "factor": 2
        }
      ]
    }
  },
  "modules": [
    {
      "code": "INF-101",
      "name": "Grundlagen der Programmierung",
      "credits": 8,
      "grading": "graded",
      "countsTowardAverage": true,
      "category": "Pflicht",
      "offering": "winter",
      "typicalSemester": 1
    },
    {
      "code": "INF-102",
      "name": "Algorithmen und Datenstrukturen",
      "credits": 8,
      "grading": "graded",
      "countsTowardAverage": true,
      "category": "Pflicht",
      "offering": "summer",
      "typicalSemester": 2,
      "prerequisites": ["INF-101"]
    },
    {
      "code": "MAT-111",
      "name": "Lineare Algebra",
      "credits": 9,
      "grading": "graded",
      "countsTowardAverage": true,
      "category": "Pflicht",
      "offering": "winter",
      "typicalSemester": 1
    },
    {
      "code": "MAT-102",
      "name": "Analysis I",
      "credits": 9,
      "grading": "graded",
      "countsTowardAverage": true,
      "category": "Pflicht",
      "offering": "summer",
      "typicalSemester": 2
    },
    {
      "code": "INF-211",
      "name": "Rechnerarchitektur und Betriebssysteme",
      "credits": 8,
      "grading": "graded",
      "countsTowardAverage": true,
      "category": "Pflicht",
      "offering": "winter",
      "typicalSemester": 3
    },
    {
      "code": "INF-202",
      "name": "Theoretische Informatik",
      "credits": 8,
      "grading": "graded",
      "countsTowardAverage": true,
      "category": "Pflicht",
      "offering": "summer",
      "typicalSemester": 4,
      "prerequisites": ["MAT-111"]
    },
    {
      "code": "SQ-101",
      "name": "Schlüsselqualifikation: Wissenschaftliches Arbeiten",
      "credits": 5,
      "grading": "pass_fail",
      "countsTowardAverage": false,
      "category": "Schlüsselqualifikation",
      "offering": "both",
      "typicalSemester": 3
    },
    {
      "code": "WP-401",
      "name": "Datenbanksysteme",
      "credits": 6,
      "grading": "graded",
      "countsTowardAverage": true,
      "category": "Wahlpflicht",
      "offering": "winter",
      "typicalSemester": 5
    },
    {
      "code": "WP-403",
      "name": "Maschinelles Lernen",
      "credits": 6,
      "grading": "graded",
      "countsTowardAverage": true,
      "category": "Wahlpflicht",
      "offering": "summer",
      "typicalSemester": 5,
      "prerequisites": ["MAT-111"]
    },
    {
      "code": "BA-601",
      "name": "Bachelorarbeit",
      "credits": 12,
      "grading": "graded",
      "countsTowardAverage": true,
      "category": "Abschlussarbeit",
      "offering": "both",
      "typicalSemester": 6
    }
  ],
  "areas": [
    {
      "id": "pflicht",
      "name": "Pflichtbereich",
      "minCredits": 50,
      "moduleCodes": ["INF-101", "INF-102", "MAT-111", "MAT-102", "INF-211", "INF-202"]
    },
    {
      "id": "wahlpflicht",
      "name": "Wahlpflichtbereich",
      "minCredits": 6,
      "maxCredits": 12,
      "moduleCodes": ["WP-401", "WP-403"]
    },
    {
      "id": "schluesselqualifikationen",
      "name": "Schlüsselqualifikationen",
      "minCredits": 5,
      "moduleCodes": ["SQ-101"]
    },
    {
      "id": "abschluss",
      "name": "Bachelorarbeit",
      "minCredits": 12,
      "maxCredits": 12,
      "moduleCodes": ["BA-601"]
    }
  ]
}
